Release Year,Title,Origin/Ethnicity,Director,Cast,Genre,Wiki Page,Plot
1913,Atlantis,American,Unknown,,unknown,https://en.wikipedia.org/wiki/Atlantis_(1913_film),"Dr. Friedrich von Kammacher (Olaf Fønss), a surgeon, is devastated after his wife develops a brain disorder and is institutionalized. On the advice of his parents, von Kammacher leaves Denmark to gain some respite from his wife's illness. Von Kammacher travels to Berlin, where he meets a young dancer named Ingigerd (Ida Orloff) and the doctor becomes fond of her and very interested in her. However she has a large amount of admirers and thus Von Kammacher gives up on her. However, while in Paris he sees an ad in the paper that she is going to New York with her father and decides to follow her. Von Kammacher buys a first ticket on the same liner as Ingigered, the SS Roland.
Aboard the ship, von Kammacher learns Ingigerd has a boyfriend with her and thus he backs down. Shortly after, he is called to treat a young Russian girl with seasickness and they nearly get romantically involved but class stops this from happening.
Halfway across the sea the Roland strikes an unseen object which causes massive flooding and dooms the ship. The passengers panic as the ship sinks into the Atlantic. Von Kammacher finds Ingigered passed out in her cabin from shock and carries her to a lifeboat. He goes back and searches in vain her father but when he can't find him, von Kammacher returns to the lifeboat and holds Ingigereds hand as the lifeboat pulls away. They watch in horror as the Roland sinks into the ocean. The liner sinks so rapidly that many of the lifeboats are never launched and several passengers are swept into the sea and drowned. By morning, only von Kammacher's lifeboat is still floating (the rest having been swamped by swimmers) and 8 still alive. They are spotted by a cargo liner and saved. Ingigerd is devastated when she is told that there are no more survivors and both her father and boyfriend have drowned.
Von Kammacher and Ingigerd arrive in New York and she is unable to continue with her career since she is still shocked over the Roland disaster. Von Kammacher tries to tell her that he loves her and wants a life with her in New York but she refuses to be tied down by one man. He gives up on her and they go their separate ways after she turns down his offer to live with him in New York. Von Kammacher is impressed by an art gallery and takes an interest in fine art. Through the artistic community, he is introduced to a kind and pleasant sculptor named Eva Burns, and they develop a friendship. A New York doctor, who is a friend of von Kammacher, offers him the use of a mountain cabin, where it is hoped that Friedrich will find some peace and solace. While he is in the mountains, a telegram from Denmark arrives in New York with information that von Kammacher's wife has died. Upon hearing the news, Friedrich falls critically ill. Eva takes it upon herself to tend to him in the mountain cabin. As she nurses him back to health, their relationship blossoms. Happiness returns to Friedrich's life as he realizes Eva will be a good mother for his children."
1913,Barney Oldfield's Race for a Life,American,Mack Sennett,"Mack Sennett, Mabel Normand, Ford Sterling, Barney Oldfield",comedy,https://en.wikipedia.org/wiki/Barney_Oldfield%27s_Race_for_a_Life,Barney Oldfield races a speeding locomotive to rescue a damsel in distress tied up on the tracks by evil villain Ford Sterling.
1913,Bob's Baby,American,Unknown,Jean Acker,comedy,https://en.wikipedia.org/wiki/Bob%27s_Baby,"Bob, a typically devoted husband, is told by his wife that the stork has paid a visit to their household; the first time, it turns out to be a puppy; the second time, expecting another canine, he is surprised to find the more traditional offspring."
1913,Cohen Saves the Flag,American,Mack Sennett,"Ford Sterling, Mabel Normand",comedy,https://en.wikipedia.org/wiki/Cohen_Saves_the_Flag,"Cohen (Ford Sterling) and his rival Goldberg (Henry Lehrman) enlist in the Union Army during the American Civil War. Goldberg receives a lieutenant’s commission while Cohen becomes a sergeant. During the Battle of Gettysburg, Cohen inadvertently becomes a hero when he tosses back an enemy hand grenade and raises a fallen flag in the midst of the conflict. Goldberg conspires to have Cohen shot by a firing squad, but Cohen’s girlfriend Rebecca (Mabel Normand) rides to the rescue and details Cohen’s battlefield bravery. Cohen is hailed for his valor and later exacts revenge on Goldberg."
1913,Dr. Jekyll and Mr. Hyde,American,Herbert Brenon and Carl Laemmle,King Baggot,horror,https://en.wikipedia.org/wiki/Dr._Jekyll_and_Mr._Hyde_(1913_film),"Dr. Henry Jekyll (King Baggot) sends a note to his fiancée, Alice (Jane Gail), and her father (Matt B. Snyder) to say that instead of accompanying them to the opera, he must give more time to his charity patients. At Jekyll’s practice, his friends Dr. Lanyon (Howard Crampton) and Utterson (William Sorrel), a lawyer, ridicule him for what they consider his dangerous research. Alice and her father also visit Jekyll’s rooms, but although apologetic, the doctor insists on devoting his time to his patients. That night, however, Jekyll undertakes a dangerous experiment, swallowing a drug intended to releases his evil self. His body convulses, and he transforms into a hunched, twisted figure.
The strange creature emerges from Jekyll’s room, bearing a note in Jekyll’s handwriting that orders the household staff to treat the stranger – “Mr Hyde” – as himself. Hyde then slips out into the night, terrorising the patrons of a nearby tavern before finding himself lodgings. From these rooms he begins a career of evil, until one night he attacks and injures a crippled child. Outraged witnesses corner Hyde and force him to agree to compensate the boy. Hyde reluctantly leads one man back to Jekyll’s house and gives him money. During this passage of events, a worried Dr. Utterson sees Hyde entering Jekyll’s house. Inside, Hyde takes a potion that transforms him back to Jekyll.
The doctor swears that he will abandon his experiments and never tempt fate again; but that night, without taking the drug, he turns spontaneously into Hyde."
1913,The Evidence of the Film,American,"Lawrence Marston, Edwin Thanhouser","William Garwood, Marie Eline",crime,https://en.wikipedia.org/wiki/The_Evidence_of_the_Film,"The Evidence of the Film tells the story of a messenger boy at a film studio who is wrongfully accused of stealing bonds worth $20,000. He is saved by his sister, a film cutter, who comes across some footage of her brother inadvertently walking into a location shot and being knocked down by the real-life villain."
1913,The Face at the Window,American,Unknown,"Earle Foxe, Irene Boyle, Stuart Holmes",drama,https://en.wikipedia.org/wiki/The_Face_at_the_Window_(1913_film),"As described in a 1913 blurb: ""The foreman of the sawmill misconstrues the disappearance of his ward who has taken drastic measures to protect her guardian's interests. A startling incident reveals the girl's motive.""[2]"
1913,The Quakeress,American,Raymond B. West,Louise Glaum,drama,https://en.wikipedia.org/wiki/The_Quakeress,"The setting is an early American village, where a young Quaker woman, Priscilla (played by Glaum), is in love with the schoolmaster, John Hart (played by Ray). The local minister, Rev. Cole (played by Taylor), who calls on her at her cabin with flowers, is an unwelcome suitor. In revenge, he has ""blue laws"" passed, among them is one requiring attendance at church on Sunday.
Priscilla refuses to comply with the law and is arrested. After being plunged in and out of water and pilloried, she is banished from the colony. John goes with her. They are attacked by Indians and John is badly wounded. Priscilla manages to get back to the village in time to warn the Puritans of an impending attack. They defeat the Indians after a desperate battle.
The Rev. Cole, who has been mortally wounded, begs Priscilla's forgiveness and the Puritans make amends for their harsh treatment of her.[1]"
1913,The Restless Spirit,American,Allan Dwan,"J. Warren Kerrigan, Pauline Bush",drama,https://en.wikipedia.org/wiki/The_Restless_Spirit,"The film begins with the Dreamer, a restless and disappointed dreamer who has a wife and child. He gazes at his hands and dreams of becoming a conqueror, but laments that no chance comes to him and continues to dream. The Dreamer becomes the subject of ridicule and his wife becomes the subject of pity by the community. The Dreamer decides enter the world of men and abandons his wife leaving her to seek refuge in her father. Her father wishes for her to marry a wealthy gentleman who is also a stranger in the town. The Dreamer heads into the desert and wanders until exhaustion takes its toll. A woman, ""The Desert Flower"", finds him and takes him to her hut in the desert. There the woman spends her time looking over the garments of the man who courted her, the same stranger now attempting to marry the Dreamer's wife. The woman learns of the Dreamer's story and shows the dreamer the futility of conquering worlds unknown when he cannot conquer his own small corner of the world.[1] The Dreamer sees himself in the roles of great conquerors, but each vision ends with death. The Dreamer's wife has been kicked out for refusing to marry the stranger, and is reunited with the Dreamer on the edge of the desert. The stranger is sent out into the desert and the Dreamer and his wife return to the town. In time, the Dreamer becomes respected by the community.[2]"
1913,The Telephone Girl and the Lady,American,D.W. Griffith,"Mae Marsh, Claire McDowell",drama,https://en.wikipedia.org/wiki/The_Telephone_Girl_and_the_Lady,"A telephone operator is walking out with a handsome police sergeant; her father insists that the husband for her is a plump, comfortable grocery store owner. The Lady picks up her jewels from the jewellery and brings them home, followed by a jewel thief on a stolen bicycle. She puts them in her safe, and goes to give the telephone girl a present of a necklace in thanks for her work. As the Lady answers the telephone and accepts the Telephone Girl's effusive thanks, the door creaks open – it is the masked thief! She tells the girl on the other end of the line that she's being robbed. While the thief grills the lady, the telephone girl calls the police, but there's a riot and calls about that prevent her getting through. She runs out of the exchange and spots the sergeant conveniently riding by. He lifts her onto his horse and they gallop to the rescue. Meanwhile, with an implicit rape threat the thief has forced the lady to reveal the safe concealed behind a picture. Just in time, the sergeant bursts in as the thief escapes with the jewels. After a rousing fight, helped by the feisty telephone girl and neighbours including a lady in a huge hat, the sergeant drags away the thief. The lady rewards the sergeant and the lovers fall into each other's arms."
1914,The Avenging Conscience,American,D. W. Griffith,"Henry B. Walthall, Blanche Sweet","drama, horror",https://en.wikipedia.org/wiki/The_Avenging_Conscience,"A young man (Henry B. Walthall) falls in love with a beautiful woman (Blanche Sweet), but is prevented by his uncle (Spottiswoode Aitken) from pursuing her. Tormented by visions of death and suffering and deciding that murder is the way of things, the young man kills his uncle and builds a wall to hide the body.
The young man's torment continues, this time caused by guilt over murdering his uncle, and he becomes sensitive to slight noises, like the tapping of a shoe or the crying of a bird. The ghost of his uncle begins appearing to him and, as he gradually loses his grip on reality, the police figure out what he has done and chase him down. In the ending sequence, we learn that the experience was all a dream and that his uncle is really alive."
1914,The Battle of the Sexes,American,D.W. Griffith,"Donald Crisp, Lilian Gish",drama,https://en.wikipedia.org/wiki/The_Battle_of_the_Sexes_(1914_film),"Frank Andrews (Donald Crisp) is a well-to-do, middle class apartment dweller who is devoted to his wife (Mary Alden) and two children, John (Robert Harron) and Jane (Lillian Gish). Andrews enters into a mid-life crisis when a fetching young lady, Cleo (Fay Tincher), moves into the apartment next door to the Andrews'. Cleo takes note of Andrews' interest in her and begins to flirt with him, going so far as to set a fire in her apartment in order to attract his aid. Before long, Andrews and Cleo are involved in an affair, and Andrews begins to neglect both his family and responsibilities at work. Humiliated and aghast at her mother's silent suffering over the situation, Jane goes next door with the idea of killing Cleo, but instead they strike up a conversation, and a mutual understanding. They hatch a plan whereby one of Cleo's former beaus (Owen Moore) appears to be courting Jane in front of Andrews, who swiftly condemns his daughter's interest in the man. Jane counters by pointing out Andrews' own poor moral choices, and he sees the error of his ways. Andrews is happily reconciled to his family, and Cleo sets out in search of new digs."
1914,Between Showers,American,Henry Lehrman,"Charlie Chaplin, Ford Sterling, Chester Conklin",unknown,https://en.wikipedia.org/wiki/Between_Showers,"Chaplin and Sterling play two young men, Masher and Rival Masher, who fight over the chance to help a young woman (Clifton) cross a muddy street. Sterling first sees the woman trying to cross and offers her an umbrella he stole from a policeman. He asks her to wait for him as he goes to get something to help her. Chaplin comes along and offers the woman to help her cross the street as well and wait for his return. While Sterling and Chaplin go to get logs, a policeman (Conklin) lifts the woman across the street. When Sterling returns with the log, he is indignant that the woman did not wait for him to come back to help her cross the muddy street and demands the umbrella back. When the woman refuses, they engage in a fight which eventually involves Chaplin."
1914,Brewster's Millions,American,"Oscar Apfel, Cecil B. DeMille","Edward Abeles, Sydney Deane, Joseph Singleton",comedy,https://en.wikipedia.org/wiki/Brewster%27s_Millions_(1914_film),"Wealthy Edwin Peter Brewster disowns his son Robert when he marries Louise Sedgwick, a woman of modest means. Many years later, when Robert dies, however, E.P. Brewster leaves one million dollars to their son Monty, a bank clerk. Shortly thereafter, Monty learns that he has inherited seven million dollars from his Uncle George on the stipulation that Monty divest himself of his grandfather's fortune within a year, without revealing why. A further stipulation is that the money must be used only for personal expenditures. Monty spends lavishly, invests in stock and makes a bet on a prize fight, but the bet and the stocks pay off. In desperation he rents and repairs a yacht to sail around the world. At one port, Monty saves Peggy Gray, his childhood sweetheart, from abduction by an Arab sheik. On the eve of gaining possession of the money, Monty proposes to Peggy, who eagerly accepts, thinking that Monty is a pauper. Then a cable informs Monty that Swearengen Jones, his uncle's executor, has absconded with the fortune. Unperturbed, Peggy and Monty marry but then are presented with the inheritance as a wedding present by Jones, who turns out to be a practical joker."
1914,A Busy Day,American,Charlie Chaplin,"Charlie Chaplin, Mack Swain, Phyllis Allen",comedy,https://en.wikipedia.org/wiki/A_Busy_Day,"In A Busy Day, a wife (played by an energetic Charlie Chaplin) becomes jealous of her husband's interest in another woman during a military parade. On her way to attack the couple, the wife interrupts the set of a film, knocking over a film director and a police officer. Finally, the husband pushes the wife off a pier and she falls into the harbor."
1914,The Call of the North,American,"Oscar Apfel, Cecil B. DeMille","Robert Edeson, Theodore Roberts",adventure,https://en.wikipedia.org/wiki/The_Call_of_the_North_(1914_film),"Graehme, Ned Stewart's father was accused of adultery and killed being innocent. Ned decided to avenge his father, but got captured and sent to the long journey to death ""la longue traverse"". Fortunately Virginia saves his life and the story's villain confesses Ned's innocence."
